{
    "$schema": "http://json-schema.org/draft-07/schema#",
    "definitions": {
      "node_information": {
        "type": "object",
        "properties": {
          "node_title": {
            "type": "string"
          },
          "node_description": {
            "type": "string"
          },
          "node_url": {
            "type": "string",
            "format": "uri"
          },
          "submission_date": {
            "type": "string",
            "format": "date-time"
          },
          "public_release_date": {
            "type": "string",
            "format": "date-time"
          }
        },
        "required": [
          "node_title",
          "node_url"
        ]
      },
      "factor": {
        "type": "object",
        "properties": {
          "factor_type": {
            "type": "string"
          },
          "decimal_value": {
            "type": "number"
          },
          "string_value": {
            "type": "string"
          },
          "reference_value": {
            "type": "string"
          },
          "unit_reference": {
            "type": "string"
          },
          "csv_column_index": {
            "type": "integer"
          }
        },
        "required": [
          "factor_type"
        ]
      },
      "factor_array": {
        "type": "array",
        "items": {
          "$ref": "#/definitions/factor"
        }
      },
      "species": {
        "type": "object",
        "properties": {
          "species_reference": {
            "type": "string"
          },
          "stoichiometry": {
            "type": "number"
          }
        },
        "required": [
          "species_reference"
        ]
      },
      "species_array": {
        "type": "array",
        "items": {
          "$ref": "#/definitions/species"
        }
      },
      "comment": {
        "type": "object",
        "properties": {
          "comment_title": {
            "type": "string"
          },
          "comment_body": {
            "type": "string"
          }
        },
        "required": [
          "comment_title",
          "comment_body"
        ]
      },
      "comment_array": {
        "type": "array",
        "items": {
          "$ref": "#/definitions/comment"
        }
      },
      "source": {
        "type": "object",
        "properties": {
          "source_name": {
            "type": "string"
          },
          "source_factors": {
            "$ref": "#/definitions/factor_array"
          },
          "source_species": {
            "$ref": "#/definitions/species_array"
          },
          "source_comments": {
            "$ref": "#/definitions/comment_array"
          }
        }
      },
      "source_array": {
        "type": "array",
        "items": {
          "$ref": "#/definitions/source"
        }
      },
      "sample": {
        "type": "object",
        "properties": {
          "sample_name": {
            "type": "string"
          },
          "sample_factors": {
            "$ref": "#/definitions/factor_array"
          },
          "sample_species": {
            "$ref": "#/definitions/species_array"
          },
          "sample_comments": {
            "$ref": "#/definitions/comment_array"
          },
          "sample_sources": {
            "$ref": "#/definitions/source_array"
          }
        }
      },
      "sample_array": {
        "type": "array",
        "items": {
          "$ref": "#/definitions/sample"
        }
      },
      "experiment": {
        "type": "object",
        "properties": {
          "experiment_name": {
            "type": "string"
          },
          "experiment_comments": {
            "$ref": "#/definitions/comment_array"
          },
          "experiment_factors": {
            "$ref": "#/definitions/factor_array"
          },
          "experiment_samples": {
            "$ref": "#/definitions/sample_array"
          },
          "experiment_datafile": {
            "type": "string"
          }
        }
      },
      "experiment_array": {
        "type": "array",
        "items": {
          "$ref": "#/definitions/experiment"
        }
      }
    },
    "type": "object",
    "title": "node",
    "properties": {
      "node_information": {
        "$ref": "#/definitions/node_information"
      },
      "node_comments": {
        "$ref": "#/definitions/comment_array"
      },
      "node_factors": {
        "$ref": "#/definitions/factor_array"
      },
      "node_experiments": {
        "$ref": "#/definitions/experiment_array"
      },
      "node_samples": {
        "$ref": "#/definitions/sample_array"
      }
    },
    "required": [
      "node_information",
      "node_experiments"
    ]
  }