{
    "node_information": {
      "node_title": "Sipos 2006, Talanta NMR Figures",
      "node_description": "Extracted figures.",
      "node_url": "www.url.com",
      "submission_date": "2018-5-25",
      "public_release_date": "2006-03-13"
    },
    "node_comments": [
      {
        "comment_title": "Study level comment on Sipos 2006.",
        "comment_body": "I manually pulled this points out with a web tool."
      }
    ],
    "node_factors": [
      {
        "factor_type": "Measurement Condition",
        "decimal_value": 25.0,
        "unit_reference": "Celsius"
      },
      {
        "factor_type": "Measurement",
        "unit_reference": "ppm",
        "reference_value": "27_Al",
        "csv_column_index": 1
      },
      {
        "factor_type": "Measurement Condition",
        "decimal_value": 78.204,
        "reference_value": "27_Al",
        "unit_reference": "MHz"
      },
      {
        "factor_type": "Measurement Reference",
        "unit_reference": "27_Al Reference Compound",
        "reference_value": "[KAl(SO4)2]"
      }
    ],
    "node_experiments": [
      {
        "experiment_name": "Potassium Hydroxide Assay",
        "experiment_datafile": "sipos_2006_fig3_KOH.csv",
        "experiment_samples": [
          {
            "sample_name": "Potassium Hydroxide",
            "sample_factors": [
              {
                "factor_type": "Measurement Condition",
                "unit_reference": "Molar",
                "csv_column_index": 0
              }
            ],
            "sample_species": [
              {
                "species_reference": "K+",
                "stoichiometry": 1.0
              },
              {
                "species_reference": "OH-",
                "stoichiometry": 1.0
              }
            ]
          },
          {
            "sample_name": "Aluminate Solution",
            "sample_factors": [
              {
                "factor_type": "Measurement Condition",
                "decimal_value": 0.005,
                "unit_reference": "Molar"
              },
              {
                "factor_type": "Measurement",
                "unit_reference": "ppm",
                "reference_value": "27_Al",
                "csv_column_index": 1
              }
            ],
            "sample_species": [
              {
                "species_reference": "Al(III)",
                "stoichiometry": 1.0
              }
            ],
            "sample_sources": [
              {
                "sample_name": "Aluminum Wire",
                "source_factors": [
                  {
                    "factor_type": "Material Property",
                    "decimal_value": 0.98,
                    "unit_reference": "Percent",
                    "reference_value": "Purity by Weight"
                  }
                ],
                "source_species": [
                  {
                    "species_reference": "Al(III)",
                    "stoichiometry": 1.0
                  }
                ]
              }
            ]
          }
        ],
        "experiment_comments": [
          {
            "comment_title": "Data extraction method.",
            "comment_body": "I manually pulled this points out with a web tool."
          }
        ]
      },
      {
        "experiment_name": "Lithium Hydroxide Assay",
        "experiment_datafile": "sipos_2006_fig3_LiOH.csv",
        "experiment_samples": [
          {
            "sample_name": "Lithium Hydroxide",
            "sample_factors": [
              {
                "factor_type": "Measurement Condition",
                "unit_reference": "Molar",
                "csv_column_index": 0
              }
            ],
            "sample_species": [
              {
                "species_reference": "Li+",
                "stoichiometry": 1.0
              },
              {
                "species_reference": "OH-",
                "stoichiometry": 1.0
              }
            ]
          },
          {
            "sample_name": "Aluminate Solution",
            "sample_factors": [
              {
                "factor_type": "Measurement Condition",
                "decimal_value": 0.005,
                "unit_reference": "Molar"
              },
              {
                "factor_type": "Measurement",
                "unit_reference": "ppm",
                "reference_value": "27_Al",
                "csv_column_index": 1
              }
            ],
            "sample_species": [
              {
                "species_reference": "Al(III)",
                "stoichiometry": 1.0
              }
            ],
            "sample_sources": [
              {
                "source_name": "Aluminum Wire",
                "source_factors": [
                  {
                    "factor_type": "Material Property",
                    "decimal_value": 0.98,
                    "unit_reference": "Percent",
                    "reference_value": "Purity by Weight"
                  }
                ],
                "source_species": [
                  {
                    "species_reference": "Al(III)",
                    "stoichiometry": 1.0
                  }
                ]
              }
            ]
          }
        ]
      },
      {
        "experiment_name": "Sodium Hydroxide Assay",
        "experiment_datafile": "sipos_2006_fig3_NaOH.csv",
        "experiment_samples": [
          {
            "sample_name": "Sodium Hydroxide",
            "sample_factors": [
              {
                "factor_type": "Measurement Condition",
                "unit_reference": "Molar",
                "csv_column_index": 0
              }
            ],
            "sample_species": [
              {
                "species_reference": "Na+",
                "stoichiometry": 1.0
              },
              {
                "species_reference": "OH-",
                "stoichiometry": 1.0
              }
            ]
          },
          {
            "sample_name": "Aluminate Solution",
            "sample_factors": [
              {
                "factor_type": "Measurement Condition",
                "decimal_value": 0.005,
                "unit_reference": "Molar"
              },
              {
                "factor_type": "Measurement",
                "unit_reference": "ppm",
                "reference_value": "27_Al",
                "csv_column_index": 1
              }
            ],
            "sample_species": [
              {
                "species_reference": "Al(III)",
                "stoichiometry": 1.0
              }
            ],
            "sample_sources": [
              {
                "name": "Aluminum Wire",
                "source_factors": [
                  {
                    "factor_type": "Material Property",
                    "decimal_value": 0.98,
                    "unit_reference": "Percent",
                    "reference_value": "Purity by Weight"
                  }
                ],
                "source_species": [
                  {
                    "species_reference": "Al(III)",
                    "stoichiometry": 1.0
                  }
                ]
              }
            ]
          }
        ]
      },
      {
        "experiment_name": "Sodium Hydroxide v Aluminate Assay",
        "experiment_datafile": "sipos_2006_fig2.csv",
        "experiment_samples": [
          {
            "sample_name": "Sodium Hydroxide",
            "sample_factors": [
              {
                "factor_type": "Measurement Condition",
                "unit_reference": "Molar",
                "csv_column_index": 1
              }
            ],
            "sample_species": [
              {
                "species_reference": "Na+",
                "stoichiometry": 1.0
              },
              {
                "species_reference": "OH-",
                "stoichiometry": 1.0
              }
            ]
          },
          {
            "sample_name": "Aluminate Solution",
            "sample_factors": [
              {
                "factor_type": "Measurement Condition",
                "unit_reference": "Molar",
                "csv_column_index": 0
              },
              {
                "factor_type": "Measurement",
                "unit_reference": "ppm",
                "reference_value": "27_Al",
                "csv_column_index": 2
              }
            ],
            "sample_species": [
              {
                "species_reference": "Al(III)",
                "stoichiometry": 1.0
              }
            ]
          }
        ]
      }
    ]
  }
  